Ucid,Date,Text
547575769878454,6/25/2025,"{'agent':'Good morning, this is Arthur speaking. How can I help you?','customer':'Yes, I'm trying to find out from a current member and I have a medigap policy plan in and I'm trying to find out what the cost of the policy for 2025 will be.','customer':'Hello.','agent':'For your Medigap policy, you can see the yes, I'm here Sir, you're trying to see the cost of your Medigap policy for 2025.','customer':'Yes.','customer':'Yes.','agent':'OK, give me one second.','agent':'And what is your birthday?','customer':'6548.','agent':'OK.','agent':'And what is going to be your?','agent':'Your Medicare number.','customer':'I'm sorry.','agent':'Your Medicare number.','customer':'6V33UK2.','customer':'KE15.','agent':'Thank you for that.','agent':'I'm still with you Sir, I'm just verifying your information.','customer':'Alright.','agent':'Yes. And you said you're a current member, you're just trying to figure out your Medicare cap plan for next year. So with that being said, let me see.','agent':'What I'm, what I'm going to have to do for you, Sir, is I'm going to have to transfer you to customer service because it'd be better to be able to assist you as far as the questions you have because I'm with the Tele sales department and I don't have access to that.','agent':'Information.','agent':'So let me see.','customer':'All right.'}"
547575769878455,6/25/2025,"{'agent':'VELEY.','customer':'Yeah, V like Victor E Elephant L Larry E Elephant Y York.','customer':'IE.','agent':'OK.','agent':'On Lancaster Drive.','customer':'Yes.','agent':'OK, perfect. I was able to find it here.','customer':'And the last one.','customer':'Her last name is.','customer':'What's the name Last name?','customer':'Last name is Cho Chou.','agent':'Chou.','customer':'Yeah, and first name is Y I-CH UN.','agent':'Got it here.','agent':'Alright, and.','agent':'So Brent Lacey is your primary?','customer':'No, Doctor Furman is my primary.','customer':'I.','agent':'OK, So it looks like Brent Lacey is the only one that's not gonna be in network with us, but we could get you a PPO plan where?','customer':'Doctor Brand Leslie is on the thing. Like when I entered my name, entered his name, he was there. I mean, I still can see like it's all when I'm searching.','customer':'And let me see.','customer':'The performance from Ellen really Primary provider, specialist doctor.','customer':'Care traveling doctor visa.','agent':'OK. So I got Brent Lacey here. I got him.','customer':'Yeah, but that's it. Yeah, it's got Texas digestive disease consultants.','agent':'Yeah, the address is Suite A.','customer':'Yeah.','agent':'OK, so.','agent':'Are you taking any medication, Sir?','customer':'Yeah, I am taking mitigations.','agent':'What medications are you taking, Sir?','customer':'OK, let me read the list. I think Delsalazide disodium.','agent':'Hold on, give me a second, Sir.','agent':'OK. How many milligrams?','customer':'As a 750 milligram, 9 capsules a day.','agent':'Nine capitals a day.','customer':'Which is 9 pesos a day.','agent':'And do you get 30 days supply or 90 day supply?','customer':'90 day supply.','agent':'OK.','agent':'Your next medication, Sir?','agent':'OK.','agent':'OK. Is it once a day or twice a day?','customer':'Atorvastatin 20 milligram, 1A day, once a day.','agent':'Oh.','customer':'Metropolitan 50 milligram once a day.','agent':'30 days supply. 90 day supply.','customer':'90 all the all the 90 day supply.','customer':'Losartan 50 milligram once a day.','customer':'Amidolopine 10 milligrams a day.','agent':'Got it. Alright, so it looks like all your medications are covered, Sir, with this plan.','customer':'Can you check to see I've been drawn 8 sodium?'}"
547575769878456,6/25/2025,"{'agent':'Hi, thank you for calling. My name is Desiree. How may I help you?','customer':'Yes Sir, I'm I'm shopping at Medicare Advantage plans. My situation is I'm in Florida. My current provider is a Florida blue.','agent':'Yes Sir, I'm I'm travelling the Mediterranean plan. My situation is I'm in Florida. My current society is.','customer':'I don't know. I don't know where you are or anything, but in Florida.','customer':'The local Baptist organization in Florida, Blue had kind of a falling out and my situation is.','agent':'I don't know if I I don't know who you are or anything. I didn't say Baptist organization and we had time to settle now and my situation really my primary doctor had been on South editor in networks.','customer':'My primary doctor has been bopped out of there in network.','customer':'I've checked your website and all my doctors are in your network.','agent':'I've checked their website and all my taxes are.','customer':'I got off the phone a few minutes ago with Florida Blue and I've got a plan that they recommended that I do even though my primary doctor has been dropped and now I'm looking at a plan that looks like it's comparable to what?','agent':'I got off the phone a few minutes ago before the blue and I got a plan that they recommended that I do even though my primary gossip has been blocked and now I'm looking at a plan that looks like it's complicated.','customer':'Florida Blue offered me and I just, I would like to go over that and, and, and see where we're at on that.','agent':'Off of me and I just I would like to get everything so I didn't come and see whatever happened.','agent':'So you're interested in Florida Blue or this is United Healthcare?','agent':'OK.','customer':'I understand that I'm currently with Florida Blue. I'm I'm looking for another insurance company because my primary doctor has been dropped by Florida Blue.','customer':'OK.','agent':'Alright, I can definitely assist you with that. Give me one second. Let me just get everything set up.','agent':'Alright, how do you spell your first name?','customer':'John.','agent':'087.','agent':'And your last name.','customer':'Hamm.','customer':'IL.','agent':'HAMMIALI.','agent':'OK. And what's your date of birth?','customer':'62648.','agent':'62648.','agent':'What's a good phone number for you?','customer':'Area code 904-333-7591.','agent':'Area code 904-333-7591.','agent':'And a good e-mail.','customer':'I'll spell it out for you. It's super comp253@gmail.com. It's SUPERCOMP as in Paul 253.','customer':'At gmail.com.','agent':'COMP as in Paul 253 at Gmail dot com.','agent':'OK.','customer':'Mm-hmm.','agent':'Alright, so I'll take care of your niece today, but would it be OK for us to contact you in the future either through phone or e-mail just to talk about any products we discussed?','customer':'Sure.','agent':'OK.','agent':'And what's the address for you?','agent':'658.','agent':'English tomatoes.','customer':'It's 658 English Meadows Court.','agent':'Orange Park, FL.','customer':'Orange Park, FL.','agent':'12073.','customer':'32073.','agent':'OK. And do you have your red, white and blue Medicare card?','customer':'I do.','agent':'Can you provide me with the number on that card please?','agent':'1235.','customer':'Sure, it's one TP5G85.','agent':'285.','customer':'FT64.','agent':'264.','agent':'Alright, let me just make sure I have that right. 1P as in Paul, P as in Paul. 5G as in Green. 85F as in Frank T as in Tom 6/4.','customer':'Correct.','agent':'Cool, and what is the A&B effective date?','agent':'612013.','agent':'The authority was 712014.','customer':'The A effective date is 6/1/2013. The Part D is 7/1/2013.','agent':'Alright, thank you for that. Give me one second.','customer':'Sure.','agent':'Alright, so I'm gonna ask you a few questions to determine your eligibility. Do are you? Do you currently have diabetes?','customer':'No.','customer':'OK.','agent':'OK alright, so I'll make the process of choosing a new plan simple. By asking a few questions, I'll be able to determine the right plan for you. Have you done any research already online?','agent':'Yeah, I'm online right now.','customer':'Yeah, I'm, I'm online right now. The plan I'm looking at is the, UH, CFL-0021 PTO is what I'm looking at.','agent':'UHC FM security at 212 TTL. Alright, umm, so we'll look into that a little more in one moment. Umm, what else do you like look for in a plan? Like what are, what are like some of the key features that you look for in a plan?','agent':'It's a pretty simple.','customer':'It's pretty simple, you know, I have a routine doctor that I see every six months.','agent':'About six years ago, I was diagnosed with colon cancer.','customer':'I have, I I the only other doctor I really have is an oncologist. About six years ago I was diagnosed with colon cancer. They got it all out. I've been scanned every for the first three years I was scanned every six months. Now I'm out to a one year scan. I've been clean for six years.','agent':'Six months, mile a month or a one year standing for six years.','customer':'That a primary doctor, an oncologist, and.','agent':'That the primary doctor apologies and I've had a meeting take about two years ago. I've been going to two days.','customer':'I had a knee replaced about two years ago. I got an orthopedic guy. That's pretty much it.','agent':'OK.','agent':'Alright so I got the plans pulled up. What is the name of your primary care doctor?','customer':'Well, I've already checked that, but I'll go ahead and give it to you. His primary care doctor is Gregory McHugh. That's McHugh.','agent':'Alright. And then he's located at 810 Lane Ave.','customer':'That's correct. Yes, Sir.','agent':'Perfect, so I have them notated. Are you seeing any other specialist besides this doctor?','customer':'The only other other specialist really would be on a routine basis would be Shane Clark. So Shane last name Clark Clark.','agent':'Located at 2310 Village Square Parkway.','customer':'Correct. Uh-huh.','agent':'Perfect and any other doctors?','customer':'The only other would be the orthopedic guy and I haven't seen him in a couple of years, but his name is Richard Grimsley.','customer':'GRIGRIMSLEYI believe.','agent':'Alright, I found that doctor as well. And are you currently taking any medications on a daily basis?','customer':'I am.','agent':'Alright, can you provide me with the names of the medications and the dosage just so I can have that on file?','customer':'Yep, Yep.','customer':'Lisinopril.','customer':'And at the end of the lisinopril it's listed.','agent':'And at the end of the symmetry I was selected HTTP 2025 milligram.','customer':'HCTZ 2025 milligram.','agent':'Alright, one second.','agent':'OK. And you take that once a day or twice a day?','customer':'Correct. No, once a day. Actually I take a half a tablet once a day.','agent':'Alright. And your next one?','customer':'Gabapentin 300 milligram.','agent':'N.','agent':'Alright. And that's once a day or twice a day.','customer':'Once a day.','agent':'Once again.','agent':'OK.','customer':'Ibuprofen 800 milligram.','agent':'OK.','customer':'And the last one would be folic acid, 1 milligram.','agent':'OK, perfect. And give me one second. Let me look into this plan you were referring to.','agent':'What's the name of the plant again?','customer':'As it appears on the screen it AARP Medicare Advantage from UHC and the plan looks like it's FL-0021 which is APPO plan.','agent':'OK.','agent':'Alright, so do you have any questions? Umm, like pertaining to the plan that you wanted me to go over with you?','customer':'Not really. I mean like once again, I think it looks like it compares pretty closely to what to what Florida Blue offered me with the exception of my doctor is in your network and it's not in there, I don't think as long as it looks like.','agent':'Not really. I mean, that's not much. Again, I think that mixed up is compared pretty closely as it was, umm, it looks like.','agent':'The planning includes everything I'm looking for and everything I've had in the file. Office is basically.','customer':'The plan includes everything I'm looking for and everything I've had in the past, which is basically.','customer':'The drug coverage.','customer':'I think there's going to be a couple with you folks that aren't covered, but I think I can work that out with my pharmacy.','agent':'The blood coverage I think is going to be a couple of the results that aren't covered and I think that.','customer':'You're you're actually your Max out of pocket is a little bit less than what I've got right now.','agent':'Going to positive a little bit less and more like that right now.','agent':'My doctors are using your network, which means it's a possibility related to them. I'm sure they're going to be given that way.','customer':'My doctors are within your network, which means that the hospitals are related to them. I'm sure they're going to be within the network. co-pays look about the same. I mean everything looks comparable. I don't think I have any questions. No, no, no Sir.','agent':'With about the same and everything that's comfortable, I don't think I have any questions, OK.','agent':'Alright. Did you want to go ahead and move forward with the enrollment of this plan or?','customer':'I think I will, yeah.','agent':'Alright, so I can assist you with that. Just give me one second. Let me.','customer':'Done.','customer':'Good.','customer':'OK, OK.','agent':'Alright, perfect. And uh, so I'm gonna go ahead and start the application now. Uh, so don't use the enrollment application. I'll be reviewing some information and asking you several questions. Please answer clearly with a yes or no and let me know if you have any questions. First of all, do you understand the benefits we covered earlier, yes or no?','customer':'Yes.','agent':'Alright, And do I have your permission to record this enrollment application, yes or no?','customer':'Yes.','agent':'OK, alright. Can you confirm your first and last name?','customer':'First name is John. Excuse me, John. Last name is Hamill HAMMILL.','agent':'His name John Stephen JLHN last name is Hammond HOMMION. And what's your date of birth?','agent':'6/26/1948.','customer':'6/26/1948.','agent':'OK. Are you currently living in a nursing home or long term care facility?','customer':'No.','agent':'And what's your address?','customer':'Excuse me 658 English Meadows Court.','customer':'Orange Park, FL.','agent':'Orange Park, FL.','customer':'32073.','agent':'32073 OK. And would you like your mail sent to a different address?','customer':'No, that's that's the only address.','agent':'Alright, what's a good phone number for you?','customer':'Area code 904-333-7591.','agent':'904-333-7591 and a good e-mail address.','customer':'I'll spell it for you. It's SUPERCOM, p253@gmail.com.','agent':'SUPERCONT 253 at Gmail dot com OK do you get consent for United Healthcare and its affiliates to call the phone numbers you have provided using an auto dialer and a pre recorded voice technology Just to update you on your plan.','customer':'Yes.','agent':'Alright, and do you provide by providing an e-mail you can quickly get your plane information. We will send you a letter when new plan information is available. Is that OK with you?','customer':'Yes.','customer':'Cool.','agent':'OK, I have your preferred languages. English. You can find the summary of benefits and star rating at uhc.com/medicare. All playing materials sent you will be in English unless requested in a different language or format. Medicare request. We ask the next few questions, but they are optional and do not impact your enrollment.','agent':'Be open to answering questions about your race and ethnicity, yes or no.','customer':'Yes.','agent':'Yes, OK. Are you Hispanic, Latino or Spanish origin?','customer':'No.','agent':'No. And what is your race?','customer':'White.','agent':'Right, OK, thank you for your answer. Medicare will use this information to help identify if any gaps exist in Medicare health plans moving forward. The proposed effective date for this plan is going to be January 1st, 2025. The name of the plan is the AARP Medicare Advantage from UHC SL-0021 PPO. The plan you have chosen is not a rider but a full plan.','agent':'So, umm, John Hamill.','agent':'Are you ready to enroll in the AARP Medicare Advantage from UHC FL-0021 PPO with the starting date of January 1st, 2025 Yes or no?','customer':'Yes.','agent':'Alright, and as a reminder, this is a Medicare Advantage plan, not a Medicare Supplement plan. United Healthcare Insurance Company or one of its affiliate companies is a Medicare Advantage organization with a Medicare contract. Enrollment depends on contract renewal. You will receive your Medicare health benefits through United Healthcare instead of Original Medicare. Are you currently enrolled in Florida's Medicaid program, yes or no?','customer':'No.','agent':'No.','agent':'Give me one second.','agent':'Alright, and what's the name of your primary care doctor again?','agent':'Edward McSweeney, MCH. UGH.','customer':'Gregory McHugh MCH. UGH.','agent':'OK. And have you seen this provider before?','customer':'Yes.','agent':'Yes.','agent':'Will you have any other insurance that covers medical services such as employer or child care or VA benefits when this claim becomes effective? Yes or no?','customer':'I will have until I cancel it. I will have a dental plan, a group dental plan where I work.','agent':'OK.','agent':'OK. So would that be yes or no just for the employer child care or be able to?','customer':'Oh, I'm sorry. Yes, yes, I'm sorry.','agent':'You said dental coverage is the Let me see now.','agent':'So would it be like employer OK?','agent':'So this is like Tricare, like Tricare.','customer':'The previous the plan that I have now doesn't offer dental, that's why I didn't.','agent':'OK. And then will you have any other prescription drug coverages when this plan becomes effective, yes or no?','customer':'No.','agent':'No.','agent':'Alright, so the monthly premium for this plan is going to be $0.00. This is in addition to your property premium if you have one. If you receive any extra help, Medicare will pay all or portion of your drug premiums. We will bill you for any remainder. If you didn't have credible prescription drug coverages when you were first eligible for Medicare, you may have a late enrollment penalty. If this applies to you, we will send you a letter. For those with incomes above a certain level, Medicare may apply an extra amount for Part D if this applies to you.','agent':'If this applies to you, Medicare or the Railroad Retirement Board will withhold it from your Social Security check. You receive a notice in advance Before that happens and we are almost done. I have just a few more things I need to tell you about the plan. So you need to keep both. Medicare is part A&B. You can only be in one Medicare Advantage or Prescription Drug plan at a time. Enrolling in this plan may automatically end your enrollment in another Medicare Advantage or prescription drug plan. Medicare doesn't usually cover you while out of the country with.','agent':'Exception of limited coverage near the US border. To get the lowest cost you must use in network providers or if your plan doesn't does not have out of network coverage, you can only use in network providers with the exception of emergency or urgently needed care. You'll receive an annual Notice of Change document in the fall. It will explain any changes to benefits, premiums and or copays on your plan for the next year.','agent':'You should review your annual notice just to make sure the plan is still a good choice for you.','agent':'If you ever disagree with a decision about payment or services you have, you have the right to file an appeal. Will only release your information to Medicare if necessary for payment, treatment, and healthcare operations. Medicare may release your information for research and other purposes as allowed by federal statutes and regulations. The information on this enrollment is correct to the best of your knowledge. If you provide answers you know are not true, you may lose this plan. And remember, you can only.','agent':'To the enrollment of this plan before the effective date of January 1st, 2025, do you understand and agree to the information we discussed during this enrollment application, yes or no?','customer':'Yes.','agent':'Yes. Alright. So thank you. Congratulations. Your enrollment application is complete and submitted after approved by Medicare. Your plan will start on January 1st, 2025. You receive confirmation of your application has been received and instructions on how to register for your online member account where where you have access to check your application status, see benefit details.','agent':'In your evidence of coverage and more.','agent':'In the next 7 to 14 business days, watch the mail for important plan information, including your member ID. As you get ready to use your your new plan, you can download the United Healthcare mobile app and access your plan from wherever you go. Your confirmation number is going to be your Medicare number and you can call customer service at 1866627.','agent':'7806.','agent':'If you have any questions or concerns, the customer service number will also be listed on your welcome information and your member ID card.','agent':'And did you have any further questions for me?','customer':'I don't believe so.','agent':'Alright, Sir, So if you have no further questions for me and I'd like to taking a survey at the end of the call, please stay on the phone while I connect you and have a great day. OK, thank you. Alright, thank you. Bye.'}"
